{"version":"rivo-a2a-lan-v1","request_id":"pair-01HVALID","server_spki_sha256":"0123456789abcdef0123456789abcdef0123456789abcdef0123456789abcdef","client_public_key_sha256":"abcdef0123456789abcdef0123456789abcdef0123456789abcdef0123456789","expires_at":"2030-01-01T00:10:00Z","sas_words":["abandon","ability","able","about","above","absent"],"claim_token":"AAAAAAAAAAAAAAAAAAAAAAAAAAAAAAAAAAAAAAAAAAA"}
